id;title;latin_title;classes;order;description;image_src;image_alt;continents;spread_note;biotop;biotopes_note;food;food_note;proportions;reproduction;attractions;projects_note;breeding;localities_title;localities_url
1;Lev indický;Panthera leo persica;Savci (Mammalia);Šelmy (Carnivora);Lev je jedinou koèkovitou šelmou, která vykazuje výraznou pohlavní dvojtvárnost. Samec je nejen vìtší než samice, ale má navíc typickou høívu. Mláïata jsou skvrnitá a teprve ve tøech letech zcela pøebarví do plavé hnìdi dospìlých. Charakteristickým znakem lvù je ocas zakonèený štìtkou dlouhých chlupù.;;;;;;;;;;;;;;;
5;Amazoòan modrobradý;Amazona festiva;Ptáci (Aves);Papoušci (Psittaciformes);Pøevážnì zelenì zbarvený papoušek s krátkým ocasem. Má èervené èelo a kostøec a modrý proužek pøes oko a podbradek i modøe zbarvené vnìjší letky. Zobák je šedavý, oko žluté. ;;;;;;;;;;;;;;;
3;Adax;Addax nasomaculatus;Savci (Mammalia);Sudokopytníci (Artiodactyla);;;;;;;;;;;;;;;;
4;Achatina žravá;Achatina fulica;Mìkkýši (Mollusca);Plži - plicnatí (Pulmonata);Zbarvení ulity je velmi promìnlivé, nejèastìji hnìdé se svìtlejšími pruhy. Typickým poznávacím znakem je bílé nebo modrobílé obústí.;;;;;;;;;;;;;;;
9;Levhart obláèkový;Neofelis (Pardofelis) nebulosa;Savci (Mammalia);Šelmy (Carnivora);Levhart obláèkový a jeho blízký pøíbuzný levhart Diardùv mají mezi ostatními koèkami své velikosti výjimeènou kresbu srsti v podobì velkých mramorových skvrn. Mláïata se rodí se stejnou kresbou jako dospìlí, jen skvrny nejsou stínované, ale jednobarevné. Dalšími typickými znaky jsou velká hlava, dlouhý pruhovaný ocas a krátké silné nohy.;;;;;;;;;;;;;;;
6;Anakonda velká;Eunectes murinus;Plazi (Reptilia);Šupinatí (Squamata);Anakondy jsou mohutní hadi s typickou kresbou v podobì tmavých skvrn a kroužkù. Obecnì u nich platí, že samice jsou výraznì mohutnìjší než samci, ovšem dosažená velikost vždy závisí na prostøedí a množství potravy.;;;;;;;;;;;;;;;
